### DISCUSSION TITLE
Hikvision intercom digest auth - possible issue due to pull/2463

### DISCUSSION THREAD

**Discussion by mateuszdraco** [encode/httpx#2549] [Potential Issue]
I'm using httpx to get to Hikvision intercom API, which uses digest auth. It accepts the `WWW-Authenticate` token once, later it just spams with Unauthorized responses.

Python code I used to test it:
```
>>> import httpx
>>> a = httpx.DigestAuth("admin", "***")
>>> httpx.get("http://192.168.0.208/ISAPI/VideoIntercom/callStatus?format=xml", auth=a)
<Response [200 OK]>
>>> httpx.get("http://192.168.0.208/ISAPI/VideoIntercom/callStatus?format=xml", auth=a)
<Response [401 Unauthorized]>
>>> httpx.get("http://192.168.0.208/ISAPI/VideoIntercom/callStatus?format=xml", auth=a)
<Response [401 Unauthorized]>
>>> a = httpx.DigestAuth("admin", "***")
>>> httpx.get("http://192.168.0.208/ISAPI/VideoIntercom/callStatus?format=xml", auth=a)
<Response [200 OK]>
>>> httpx.get("http://192.168.0.208/ISAPI/VideoIntercom/callStatus?format=xml", auth=a)
<Response [401 Unauthorized]>
>>> httpx.get("http://192.168.0.208/ISAPI/VideoIntercom/callStatus?format=xml", auth=a)
<Response [401 Unauthorized]>
>>> httpx.get("http://192.168.0.208/ISAPI/VideoIntercom/callStatus?format=xml", auth=a)
<Response [401 Unauthorized]>
>>> httpx.get("http://192.168.0.208/ISAPI/VideoIntercom/callStatus?format=xml", auth=a)
<Response [401 Unauthorized]>
>>> a = httpx.DigestAuth("admin", "***")
>>> httpx.get("http://192.168.0.208/ISAPI/VideoIntercom/callStatus?format=xml", auth=a)
<Response [200 OK]>
>>> a = httpx.DigestAuth("admin", "***")
>>> httpx.get("http://192.168.0.208/ISAPI/VideoIntercom/callStatus?format=xml", auth=a)
<Response [200 OK]>
>>> httpx.get("http://192.168.0.208/ISAPI/VideoIntercom/callStatus?format=xml", auth=a)
<Response [401 Unauthorized]>
>>> httpx.get("http://192.168.0.208/ISAPI/VideoIntercom/callStatus?format=xml", auth=a)
<Response [401 Unauthorized]>
>>> a = httpx.DigestAuth("admin", "***")
>>> httpx.get("http://192.168.0.208/ISAPI/VideoIntercom/callStatus?format=xml", auth=a)
<Response [200 OK]>
``` 

Wireshark also shows the same, I can provide the dump but overall it's the same - httpx uses the same `nonce` token and it is rejected.

I observed this behavior with Hikvision intercom API but possibly this is more broad issue.

**Comment by zanieb** [comment]
Ref https://github.com/encode/httpx/pull/2463

**Comment by mateuszdraco** [comment]
Should I raise an issue in order to proceed with this?

**Reply by florimondmanca** [reply]
Shouldn't the Hikvision API be allowing the reuse of the server nonce?

https://en.wikipedia.org/wiki/Digest_access_authentication#Example_with_explanation

> At this point the client may make another request, reusing the server nonce value (the server only issues a new nonce for each ["401" response](https://en.wikipedia.org/wiki/HTTP_401)) but providing a new client nonce (cnonce).

My assumption is that the subsequent 401 responses don't contain a `WWW-Authenticate`, otherwise HTTPX would process that to process a new server nonce and send a new request which should successfully authenticate. Can you see this in Wireshark?

**Reply by mateuszdraco** [reply]
Here's the communication I recorded by then:
```
No.     Time           Source                Destination           Protocol Length Info
      8 4.795758       172.17.228.143        192.168.0.208         HTTP     248    GET /ISAPI/VideoIntercom/callStatus?format=xml HTTP/1.1 

Frame 8: 248 bytes on wire (1984 bits), 248 bytes captured (1984 bits) on interface \Device\NPF_-, id 0
Ethernet II, Src: Microsof_c1:07:ee (-), Dst: Microsof_74:4e:3b (-)
Internet Protocol Version 4, Src: 172.17.228.143, Dst: 192.168.0.208
Transmission Control Protocol, Src Port: 60942, Dst Port: 80, Seq: 1, Ack: 1, Len: 182
Hypertext Transfer Protocol
    GET /ISAPI/VideoIntercom/callStatus?format=xml HTTP/1.1\r\n
        [Expert Info (Chat/Sequence): GET /ISAPI/VideoIntercom/callStatus?format=xml HTTP/1.1\r\n]
        Request Method: GET
        Request URI: /ISAPI/VideoIntercom/callStatus?format=xml
        Request Version: HTTP/1.1
    Host: 192.168.0.208\r\n
    Accept: */*\r\n
    Accept-Encoding: gzip, deflate\r\n
    Connection: keep-alive\r\n
    User-Agent: python-httpx/0.23.3\r\n
    \r\n
    [Full request URI: http://192.168.0.208/ISAPI/VideoIntercom/callStatus?format=xml]
    [HTTP request 1/2]
    [Response in frame: 10]
    [Next request in frame: 12]

No.     Time           Source                Destination           Protocol Length Info
     10 4.819192       192.168.0.208         172.17.228.143        HTTP/XML 711    HTTP/1.1 401 Unauthorized 

Frame 10: 711 bytes on wire (5688 bits), 711 bytes captured (5688 bits) on interface \Device\NPF_-, id 0
Ethernet II, Src: Microsof_74:4e:3b (-), Dst: Microsof_c1:07:ee (-)
Internet Protocol Version 4, Src: 192.168.0.208, Dst: 172.17.228.143
Transmission Control Protocol, Src Port: 80, Dst Port: 60942, Seq: 1, Ack: 183, Len: 645
Hypertext Transfer Protocol
    HTTP/1.1 401 Unauthorized\r\n
        [Expert Info (Chat/Sequence): HTTP/1.1 401 Unauthorized\r\n]
        Response Version: HTTP/1.1
        Status Code: 401
        [Status Code Description: Unauthorized]
        Response Phrase: Unauthorized
    Date: Sat, 14 Jan 2023 18:45:50 GMT\r\n
    Server: webs\r\n
    Content-Length: 235\r\n
    Connection: keep-alive\r\n
    Keep-Alive: timeout=8, max=99\r\n
    X-Frame-Options: SAMEORIGIN\r\n
    Cache-Control: no-store\r\n
    Pragma: no-cache\r\n
    WWW-Authenticate: Digest qop="auth", realm="DS-E04A8C9A", nonce="NzFjZjUzNjRhNzQ3OWQwMWViZGI3MTQ4OGQ1YjZhY2Q=", stale="false", opaque="", domain="::"\r\n
    Content-Type: application/xml\r\n
    \r\n
    [HTTP response 1/2]
    [Time since request: 0.023434000 seconds]
    [Request in frame: 8]
    [Next request in frame: 12]
    [Next response in frame: 13]
    [Request URI: http://192.168.0.208/ISAPI/VideoIntercom/callStatus?format=xml]
    File Data: 235 bytes
eXtensible Markup Language
    <?xml
    <userCheck
        version="2.0"
        xmlns="http://www.isapi.org/ver20/XMLSchema">
        <statusValue>
            401
            </statusValue>
        <statusString>
            Unauthorized
            </statusString>
        <isActivated>
            false
            </isActivated>
        </userCheck>

No.     Time           Source                Destination           Protocol Length Info
     12 4.820184       172.17.228.143        192.168.0.208         HTTP     523    GET /ISAPI/VideoIntercom/callStatus?format=xml HTTP/1.1 

Frame 12: 523 bytes on wire (4184 bits), 523 bytes captured (4184 bits) on interface \Device\NPF_-}, id 0
Ethernet II, Src: Microsof_c1:07:ee (-), Dst: Microsof_74:4e:3b (-)
Internet Protocol Version 4, Src: 172.17.228.143, Dst: 192.168.0.208
Transmission Control Protocol, Src Port: 60942, Dst Port: 80, Seq: 183, Ack: 646, Len: 457
Hypertext Transfer Protocol
    GET /ISAPI/VideoIntercom/callStatus?format=xml HTTP/1.1\r\n
        [Expert Info (Chat/Sequence): GET /ISAPI/VideoIntercom/callStatus?format=xml HTTP/1.1\r\n]
        Request Method: GET
        Request URI: /ISAPI/VideoIntercom/callStatus?format=xml
        Request Version: HTTP/1.1
    Host: 192.168.0.208\r\n
    Accept: */*\r\n
    Accept-Encoding: gzip, deflate\r\n
    Connection: keep-alive\r\n
    User-Agent: python-httpx/0.23.3\r\n
     [truncated]Authorization: Digest username="admin", realm="DS-E04A8C9A", nonce="NzFjZjUzNjRhNzQ3OWQwMWViZGI3MTQ4OGQ1YjZhY2Q=", uri="/ISAPI/VideoIntercom/callStatus?format=xml", response="b13914bfa47c529908645297af500ab0", algorithm=MD5, q
    \r\n
    [Full request URI: http://192.168.0.208/ISAPI/VideoIntercom/callStatus?format=xml]
    [HTTP request 2/2]
    [Prev request in frame: 8]
    [Response in frame: 13]

No.     Time           Source                Destination           Protocol Length Info
     13 4.838126       192.168.0.208         172.17.228.143        HTTP/XML 356    HTTP/1.1 200 OK 

Frame 13: 356 bytes on wire (2848 bits), 356 bytes captured (2848 bits) on interface \Device\NPF_{-}, id 0
Ethernet II, Src: Microsof_74:4e:3b (-), Dst: Microsof_c1:07:ee (-)
Internet Protocol Version 4, Src: 192.168.0.208, Dst: 172.17.228.143
Transmission Control Protocol, Src Port: 80, Dst Port: 60942, Seq: 646, Ack: 640, Len: 290
Hypertext Transfer Protocol
    HTTP/1.1 200 OK\r\n
        [Expert Info (Chat/Sequence): HTTP/1.1 200 OK\r\n]
        Response Version: HTTP/1.1
        Status Code: 200
        [Status Code Description: OK]
        Response Phrase: OK
    Date: Sat, 14 Jan 2023 18:45:50 GMT\r\n
    Server: webs\r\n
    Content-Length: 42\r\n
    Connection: keep-alive\r\n
    Keep-Alive: timeout=8, max=98\r\n
    X-Frame-Options: SAMEORIGIN\r\n
    Cache-Control: no-store\r\n
    Pragma: no-cache\r\n
    Content-Type: application/xml\r\n
    \r\n
    [HTTP response 2/2]
    [Time since request: 0.017942000 seconds]
    [Prev request in frame: 8]
    [Prev response in frame: 10]
    [Request in frame: 12]
    [Request URI: http://192.168.0.208/ISAPI/VideoIntercom/callStatus?format=xml]
    File Data: 42 bytes
eXtensible Markup Language
    {\n\t"CallStatus":\t{\n\t\t"status":\t"idle"\n\t}\n}

No.     Time           Source                Destination           Protocol Length Info
    158 127.165718     172.17.228.143        192.168.0.208         HTTP     523    GET /ISAPI/VideoIntercom/callStatus?format=xml HTTP/1.1 

Frame 158: 523 bytes on wire (4184 bits), 523 bytes captured (4184 bits) on interface \Device\NPF_-, id 0
Ethernet II, Src: Microsof_c1:07:ee (-), Dst: Microsof_74:4e:3b (-)
Internet Protocol Version 4, Src: 172.17.228.143, Dst: 192.168.0.208
Transmission Control Protocol, Src Port: 52792, Dst Port: 80, Seq: 1, Ack: 1, Len: 457
Hypertext Transfer Protocol
    GET /ISAPI/VideoIntercom/callStatus?format=xml HTTP/1.1\r\n
        [Expert Info (Chat/Sequence): GET /ISAPI/VideoIntercom/callStatus?format=xml HTTP/1.1\r\n]
        Request Method: GET
        Request URI: /ISAPI/VideoIntercom/callStatus?format=xml
        Request Version: HTTP/1.1
    Host: 192.168.0.208\r\n
    Accept: */*\r\n
    Accept-Encoding: gzip, deflate\r\n
    Connection: keep-alive\r\n
    User-Agent: python-httpx/0.23.3\r\n
     [truncated]Authorization: Digest username="admin", realm="DS-E04A8C9A", nonce="NzFjZjUzNjRhNzQ3OWQwMWViZGI3MTQ4OGQ1YjZhY2Q=", uri="/ISAPI/VideoIntercom/callStatus?format=xml", response="d2f901a307c06b3f82a81b38c56e6bc0", algorithm=MD5, q
    \r\n
    [Full request URI: http://192.168.0.208/ISAPI/VideoIntercom/callStatus?format=xml]
    [HTTP request 1/1]
    [Response in frame: 160]

No.     Time           Source                Destination           Protocol Length Info
    160 127.186855     192.168.0.208         172.17.228.143        HTTP/XML 656    HTTP/1.1 401 Unauthorized 

Frame 160: 656 bytes on wire (5248 bits), 656 bytes captured (5248 bits) on interface \Device\NPF_-, id 0
Ethernet II, Src: Microsof_74:4e:3b (-), Dst: Microsof_c1:07:ee (-)
Internet Protocol Version 4, Src: 192.168.0.208, Dst: 172.17.228.143
Transmission Control Protocol, Src Port: 80, Dst Port: 52792, Seq: 1, Ack: 458, Len: 590
Hypertext Transfer Protocol
    HTTP/1.1 401 Unauthorized\r\n
        [Expert Info (Chat/Sequence): HTTP/1.1 401 Unauthorized\r\n]
        Response Version: HTTP/1.1
        Status Code: 401
        [Status Code Description: Unauthorized]
        Response Phrase: Unauthorized
    Date: Sat, 14 Jan 2023 18:47:53 GMT\r\n
    Server: webs\r\n
    Content-Length: 331\r\n
    Connection: keep-alive\r\n
    Keep-Alive: timeout=8, max=99\r\n
    X-Frame-Options: SAMEORIGIN\r\n
    Cache-Control: no-store\r\n
    Pragma: no-cache\r\n
    Content-Type: application/xml\r\n
    \r\n
    [HTTP response 1/1]
    [Time since request: 0.021137000 seconds]
    [Request in frame: 158]
    [Request URI: http://192.168.0.208/ISAPI/VideoIntercom/callStatus?format=xml]
    File Data: 331 bytes
eXtensible Markup Language
    <?xml
    <userCheck
        version="2.0"
        xmlns="http://www.isapi.org/ver20/XMLSchema">
        <statusValue>
            401
            </statusValue>
        <statusString>
            Unauthorized
            </statusString>
        <isActivated>
            true
            </isActivated>
        <lockStatus>
            unlock
            </lockStatus>
        <unlockTime>
            0
            </unlockTime>
        <retryLoginTime>
            4
            </retryLoginTime>
        </userCheck>

**Reply by mateuszdraco** [reply]
The fact of life is: it stopped working. Can we have a flag to workaround this issue?

**Reply by mateuszdraco** [reply]
And about the description from wiki, what is cnonce in this example? I believe nonce in Authorization is the same with each subsequent request.

**Reply by florimondmanca** [reply]
Thanks a lot for the Wireshark record, that’s very helpful.

After a thorough review of the output, the code, the Wikipedia overview the spec, I don’t see what could be triggering an issue on our side.

Unfortunately Wireshark has truncated the full Authorization header. We can see it ends with « q » which I assume would be the beginning of the qop field. But so we don’t get to see if cnonce is included (given the code, it should be as the challenge has a qop field set).

It could be helpful to try and get the full Authorization header sent?

Also, the spec says servers MAY accept a nonce being returned only once, in which case they should send back a 401 with a new nonce in WWW-Authenticate and optionally stale=true (for browsers).

The output confirms the API doesn’t return such a WWW-Authenticate.

This would be consistent with the server refusing our request as invalid.

> The fact of life is: it stopped working. Can we have a flag to workaround this issue?

I assume this means you pinned HTTPX to a version where things still work? Which version is it? Could help pin point what change triggers this issue in your case. I assume it would be PR #2463 which makes HTTPX reuse the challenge always (until a 401 with WWW-Authenticate is received), in line with Requests.

Are you able to reproduce with Requests?

**Reply by mateuszdraco** [reply]
By any chance, do you have some experience with Wireshark and can give me some hints about how to enable it? If not I can try to look for that and provide you a better example.

So my use case is that I'm using httpx through Home Assistant :) and they update httpx version on regular basis, which is great, yet Hikvision integration stopped working for me. I managed to downgrade httpx manually on my VM and eventually it's working again, yet I don't update Home Assistant since then. I've opened [another request](https://github.com/home-assistant/core/issues/85888) on HA as well. And yes, it worked before PR #2463.

**Reply by florimondmanca** [reply]
> By any chance, do you have some experience with Wireshark and can give me some hints about how to enable it? If not I can try to look for that and provide you a better example.

I don’t have much experience, unfortunately!

You should be able to get the full output in a Python console as in initial discussion post using HTTPX_LOG_LEVEL=trace: 
https://www.python-httpx.org/environment_variables/

**Comment by mateuszdraco** [comment]
Unfortunately there is not that much info with the log level set:
```
HTTPX_LOG_LEVEL=trace python                                                                                                                                                  ✔  
Python 3.10.6 (main, Nov 14 2022, 16:10:14) [GCC 11.3.0] on linux
Type "help", "copyright", "credits" or "license" for more information.
>>> import httpx
>>> httpx.__version__
'0.23.3'
>>> a = httpx.DigestAuth("redacted", "redacted")
>>> httpx.get("http://192.168.0.208/ISAPI/VideoIntercom/callStatus?format=xml", auth=a)
TRACE [2023-02-05 13:21:16] httpx._config - load_ssl_context verify=True cert=None trust_env=True http2=False
TRACE [2023-02-05 13:21:16] httpx._config - load_verify_locations cafile=/home/mateusz/src/py-httpx/lib/python3.10/site-packages/certifi/cacert.pem
DEBUG [2023-02-05 13:21:16] httpx._client - HTTP Request: GET http://192.168.0.208/ISAPI/VideoIntercom/callStatus?format=xml "HTTP/1.1 401 Unauthorized"
DEBUG [2023-02-05 13:21:17] httpx._client - HTTP Request: GET http://192.168.0.208/ISAPI/VideoIntercom/callStatus?format=xml "HTTP/1.1 200 OK"
<Response [200 OK]>
>>> httpx.get("http://192.168.0.208/ISAPI/VideoIntercom/callStatus?format=xml", auth=a)
TRACE [2023-02-05 13:21:22] httpx._config - load_ssl_context verify=True cert=None trust_env=True http2=False
TRACE [2023-02-05 13:21:22] httpx._config - load_verify_locations cafile=/home/mateusz/src/py-httpx/lib/python3.10/site-packages/certifi/cacert.pem
DEBUG [2023-02-05 13:21:24] httpx._client - HTTP Request: GET http://192.168.0.208/ISAPI/VideoIntercom/callStatus?format=xml "HTTP/1.1 401 Unauthorized"
<Response [401 Unauthorized]>
```

I'll try to find more data with wireshark.

**Reply by florimondmanca** [reply]
Hmm unfortunately trace logging seems to have been removed from HTTPCore (the low-level networking layer), and the docs page is out of date.

In fact, there's ongoing work to revamp the logging setup. https://github.com/encode/httpx/pull/2547

**Reply by mateuszdraco** [reply]
`192.168.0.208` is my hikvision intercom (probably that's obvious ;))

```
No.     Time           Source                Destination           Protocol Length Authorization Info
     24 11.327519      172.22.93.224         192.168.0.208         HTTP     248                  GET /ISAPI/VideoIntercom/callStatus?format=xml HTTP/1.1 

Frame 24: 248 bytes on wire (1984 bits), 248 bytes captured (1984 bits) on interface -, id 0
Ethernet II, Src: -, Dst: -
Internet Protocol Version 4, Src: 172.22.93.224, Dst: 192.168.0.208
Transmission Control Protocol, Src Port: 47130, Dst Port: 80, Seq: 1, Ack: 1, Len: 182
Hypertext Transfer Protocol
    GET /ISAPI/VideoIntercom/callStatus?format=xml HTTP/1.1\r\n
        [Expert Info (Chat/Sequence): GET /ISAPI/VideoIntercom/callStatus?format=xml HTTP/1.1\r\n]
            [GET /ISAPI/VideoIntercom/callStatus?format=xml HTTP/1.1\r\n]
            [Severity level: Chat]
            [Group: Sequence]
        Request Method: GET
        Request URI: /ISAPI/VideoIntercom/callStatus?format=xml
        Request Version: HTTP/1.1
    Host: 192.168.0.208\r\n
    Accept: */*\r\n
    Accept-Encoding: gzip, deflate\r\n
    Connection: keep-alive\r\n
    User-Agent: python-httpx/0.23.3\r\n
    \r\n
    [Full request URI: http://192.168.0.208/ISAPI/VideoIntercom/callStatus?format=xml]
    [HTTP request 1/2]
    [Response in frame: 26]
    [Next request in frame: 28]

No.     Time           Source                Destination           Protocol Length Authorization Info
     26 11.426990      192.168.0.208         172.22.93.224         HTTP/XML 711                  HTTP/1.1 401 Unauthorized 

Frame 26: 711 bytes on wire (5688 bits), 711 bytes captured (5688 bits) on interface -, id 0
Ethernet II, Src: -, Dst: -
Internet Protocol Version 4, Src: 192.168.0.208, Dst: 172.22.93.224
Transmission Control Protocol, Src Port: 80, Dst Port: 47130, Seq: 1, Ack: 183, Len: 645
Hypertext Transfer Protocol
    HTTP/1.1 401 Unauthorized\r\n
        [Expert Info (Chat/Sequence): HTTP/1.1 401 Unauthorized\r\n]
            [HTTP/1.1 401 Unauthorized\r\n]
            [Severity level: Chat]
            [Group: Sequence]
        Response Version: HTTP/1.1
        Status Code: 401
        [Status Code Description: Unauthorized]
        Response Phrase: Unauthorized
    Date: Sun, 05 Feb 2023 13:47:33 GMT\r\n
    Server: webs\r\n
    Content-Length: 235\r\n
        [Content length: 235]
    Connection: keep-alive\r\n
    Keep-Alive: timeout=8, max=99\r\n
    X-Frame-Options: SAMEORIGIN\r\n
    Cache-Control: no-store\r\n
    Pragma: no-cache\r\n
    WWW-Authenticate: Digest qop="auth", realm="DS-E04A8C9A", nonce="NjA4NDRhNGZmZDAyYzA3NTBhM2VjOTY4MmI4MjVhOGU=", stale="false", opaque="", domain="::"\r\n
    Content-Type: application/xml\r\n
    \r\n
    [HTTP response 1/2]
    [Time since request: 0.099471000 seconds]
    [Request in frame: 24]
    [Next request in frame: 28]
    [Next response in frame: 29]
    [Request URI: http://192.168.0.208/ISAPI/VideoIntercom/callStatus?format=xml]
    File Data: 235 bytes
eXtensible Markup Language

No.     Time           Source                Destination           Protocol Length Authorization Info
     28 11.428124      172.22.93.224         192.168.0.208         HTTP     523    Digest username="admin", realm="DS-E04A8C9A", nonce="NjA4NDRhNGZmZDAyYzA3NTBhM2VjOTY4MmI4MjVhOGU=", uri="/ISAPI/VideoIntercom/callStatus?format=xml", response="b9c3e641124d34cc74e8df3d900b9ea2", algorithm=MD5, qop=auth, nc=00000001, cnonce="342bcd7bc73b5f86" GET /ISAPI/VideoIntercom/callStatus?format=xml HTTP/1.1 

Frame 28: 523 bytes on wire (4184 bits), 523 bytes captured (4184 bits) on interface -, id 0
Ethernet II, Src: -, Dst: -
Internet Protocol Version 4, Src: 172.22.93.224, Dst: 192.168.0.208
Transmission Control Protocol, Src Port: 47130, Dst Port: 80, Seq: 183, Ack: 646, Len: 457
Hypertext Transfer Protocol
    GET /ISAPI/VideoIntercom/callStatus?format=xml HTTP/1.1\r\n
        [Expert Info (Chat/Sequence): GET /ISAPI/VideoIntercom/callStatus?format=xml HTTP/1.1\r\n]
            [GET /ISAPI/VideoIntercom/callStatus?format=xml HTTP/1.1\r\n]
            [Severity level: Chat]
            [Group: Sequence]
        Request Method: GET
        Request URI: /ISAPI/VideoIntercom/callStatus?format=xml
        Request Version: HTTP/1.1
    Host: 192.168.0.208\r\n
    Accept: */*\r\n
    Accept-Encoding: gzip, deflate\r\n
    Connection: keep-alive\r\n
    User-Agent: python-httpx/0.23.3\r\n
     [truncated]Authorization: Digest username="admin", realm="DS-E04A8C9A", nonce="NjA4NDRhNGZmZDAyYzA3NTBhM2VjOTY4MmI4MjVhOGU=", uri="/ISAPI/VideoIntercom/callStatus?format=xml", response="b9c3e641124d34cc74e8df3d900b9ea2", algorithm=MD5, q
         username="admin"
         realm="DS-E04A8C9A"
         nonce="NjA4NDRhNGZmZDAyYzA3NTBhM2VjOTY4MmI4MjVhOGU="
         uri="/ISAPI/VideoIntercom/callStatus?format=xml"
         response="b9c3e641124d34cc74e8df3d900b9ea2"
         algorithm=MD5
         qop=auth
         nc=00000001
    \r\n
    [Full request URI: http://192.168.0.208/ISAPI/VideoIntercom/callStatus?format=xml]
    [HTTP request 2/2]
    [Prev request in frame: 24]
    [Response in frame: 29]

No.     Time           Source                Destination           Protocol Length Authorization Info
     29 11.495403      192.168.0.208         172.22.93.224         HTTP/XML 356                  HTTP/1.1 200 OK 

Frame 29: 356 bytes on wire (2848 bits), 356 bytes captured (2848 bits) on interface -, id 0
Ethernet II, Src: -, Dst: -
Internet Protocol Version 4, Src: 192.168.0.208, Dst: 172.22.93.224
Transmission Control Protocol, Src Port: 80, Dst Port: 47130, Seq: 646, Ack: 640, Len: 290
Hypertext Transfer Protocol
    HTTP/1.1 200 OK\r\n
        [Expert Info (Chat/Sequence): HTTP/1.1 200 OK\r\n]
            [HTTP/1.1 200 OK\r\n]
            [Severity level: Chat]
            [Group: Sequence]
        Response Version: HTTP/1.1
        Status Code: 200
        [Status Code Description: OK]
        Response Phrase: OK
    Date: Sun, 05 Feb 2023 13:47:33 GMT\r\n
    Server: webs\r\n
    Content-Length: 42\r\n
        [Content length: 42]
    Connection: keep-alive\r\n
    Keep-Alive: timeout=8, max=98\r\n
    X-Frame-Options: SAMEORIGIN\r\n
    Cache-Control: no-store\r\n
    Pragma: no-cache\r\n
    Content-Type: application/xml\r\n
    \r\n
    [HTTP response 2/2]
    [Time since request: 0.067279000 seconds]
    [Prev request in frame: 24]
    [Prev response in frame: 26]
    [Request in frame: 28]
    [Request URI: http://192.168.0.208/ISAPI/VideoIntercom/callStatus?format=xml]
    File Data: 42 bytes
eXtensible Markup Language

No.     Time           Source                Destination           Protocol Length Authorization Info
     36 14.928955      172.22.93.224         192.168.0.208         HTTP     523    Digest username="admin", realm="DS-E04A8C9A", nonce="NjA4NDRhNGZmZDAyYzA3NTBhM2VjOTY4MmI4MjVhOGU=", uri="/ISAPI/VideoIntercom/callStatus?format=xml", response="099ab5da88415e46a0ff2945f07c790b", algorithm=MD5, qop=auth, nc=00000002, cnonce="c3ad2ae240972f2c" GET /ISAPI/VideoIntercom/callStatus?format=xml HTTP/1.1 

Frame 36: 523 bytes on wire (4184 bits), 523 bytes captured (4184 bits) on interface -, id 0
Ethernet II, Src: -, Dst: -
Internet Protocol Version 4, Src: 172.22.93.224, Dst: 192.168.0.208
Transmission Control Protocol, Src Port: 59164, Dst Port: 80, Seq: 1, Ack: 1, Len: 457
Hypertext Transfer Protocol
    GET /ISAPI/VideoIntercom/callStatus?format=xml HTTP/1.1\r\n
        [Expert Info (Chat/Sequence): GET /ISAPI/VideoIntercom/callStatus?format=xml HTTP/1.1\r\n]
            [GET /ISAPI/VideoIntercom/callStatus?format=xml HTTP/1.1\r\n]
            [Severity level: Chat]
            [Group: Sequence]
        Request Method: GET
        Request URI: /ISAPI/VideoIntercom/callStatus?format=xml
        Request Version: HTTP/1.1
    Host: 192.168.0.208\r\n
    Accept: */*\r\n
    Accept-Encoding: gzip, deflate\r\n
    Connection: keep-alive\r\n
    User-Agent: python-httpx/0.23.3\r\n
     [truncated]Authorization: Digest username="admin", realm="DS-E04A8C9A", nonce="NjA4NDRhNGZmZDAyYzA3NTBhM2VjOTY4MmI4MjVhOGU=", uri="/ISAPI/VideoIntercom/callStatus?format=xml", response="099ab5da88415e46a0ff2945f07c790b", algorithm=MD5, q
         username="admin"
         realm="DS-E04A8C9A"
         nonce="NjA4NDRhNGZmZDAyYzA3NTBhM2VjOTY4MmI4MjVhOGU="
         uri="/ISAPI/VideoIntercom/callStatus?format=xml"
         response="099ab5da88415e46a0ff2945f07c790b"
         algorithm=MD5
         qop=auth
         nc=00000002
    \r\n
    [Full request URI: http://192.168.0.208/ISAPI/VideoIntercom/callStatus?format=xml]
    [HTTP request 1/1]
    [Response in frame: 42]

No.     Time           Source                Destination           Protocol Length Authorization Info
     42 15.111215      192.168.0.208         172.22.93.224         HTTP/XML 656                  HTTP/1.1 401 Unauthorized 

Frame 42: 656 bytes on wire (5248 bits), 656 bytes captured (5248 bits) on interface -, id 0
Ethernet II, Src: -, Dst: -
Internet Protocol Version 4, Src: 192.168.0.208, Dst: 172.22.93.224
Transmission Control Protocol, Src Port: 80, Dst Port: 59164, Seq: 1, Ack: 458, Len: 590
Hypertext Transfer Protocol
    HTTP/1.1 401 Unauthorized\r\n
        [Expert Info (Chat/Sequence): HTTP/1.1 401 Unauthorized\r\n]
            [HTTP/1.1 401 Unauthorized\r\n]
            [Severity level: Chat]
            [Group: Sequence]
        Response Version: HTTP/1.1
        Status Code: 401
        [Status Code Description: Unauthorized]
        Response Phrase: Unauthorized
    Date: Sun, 05 Feb 2023 13:47:37 GMT\r\n
    Server: webs\r\n
    Content-Length: 331\r\n
        [Content length: 331]
    Connection: keep-alive\r\n
    Keep-Alive: timeout=8, max=99\r\n
    X-Frame-Options: SAMEORIGIN\r\n
    Cache-Control: no-store\r\n
    Pragma: no-cache\r\n
    Content-Type: application/xml\r\n
    \r\n
    [HTTP response 1/1]
    [Time since request: 0.182260000 seconds]
    [Request in frame: 36]
    [Request URI: http://192.168.0.208/ISAPI/VideoIntercom/callStatus?format=xml]
    File Data: 331 bytes
eXtensible Markup Language

```

**Reply by florimondmanca** [reply]
It's very strange.

I don't see `cnonce` in this detailed output, but in the code it should be included along with `nc` and `qop`: https://github.com/encode/httpx/blob/master/httpx/_auth.py#L296

Do you happen to have access to the source code of the installed httpx package on your host, and verify if this line of code is present?

**Reply by mateuszdraco** [reply]
Frame 36 above:

`
Digest username="admin", realm="DS-E04A8C9A", nonce="NjA4NDRhNGZmZDAyYzA3NTBhM2VjOTY4MmI4MjVhOGU=", uri="/ISAPI/VideoIntercom/callStatus?format=xml", response="099ab5da88415e46a0ff2945f07c790b", algorithm=MD5, qop=auth, nc=00000002, cnonce="c3ad2ae240972f2c" GET /ISAPI/VideoIntercom/callStatus?format=xml HTTP/1.1 
`

**Reply by florimondmanca** [reply]
Okay. At this point I'm quite clueless.

Do you have a product sheet for the device you're using? So we can see if it uses any kind of special of un-advertized version of HTTP digest.

Can you confirm if you get the same behavior with Requests? https://requests.readthedocs.io/en/latest/user/authentication/#digest-authentication

These would be my last hypotheses until we consider a `reuse_challenge=False` flag.

**Reply by mateuszdraco** [reply]
If used as in documentation: 
```
requests.get(url, auth=HTTPDigestAuth('redacted', 'redacted'))
```
then it will work. If I store auth and try to reuse it - it's not working. So I think it's the same as httpx.

As of the intercom, that's the model: [ds-kv8113-wme1-b](https://www.hikvision.com/pl/products/Video-Intercom-Products/IP-Series/Pro-Series/ds-kv8113-wme1-b-/). You may find it's documentation [here](https://github.com/loozhengyuan/hikvision-sdk/blob/master/resources/isapi.pdf) on page 72.

**Reply by florimondmanca** [reply]
Are you able to get away with _not_ reusing `httpx.DigestAuth()`, i.e. passing a new instance on each request?

**Reply by mateuszdraco** [reply]
I can submit this as a request to HomeAssistant, if that's the advised solution.

**Reply by florimondmanca** [reply]
> I can submit this as a request to HomeAssistant, if that's the advised solution.

It would make the code return to its prior state — authenticating on every request.

**Reply by lovelydinosaur** [reply]
> If I store auth and try to reuse it - it's not working. So I think it's the same as httpx.

If the digest auth isn't working on either the `requests` or `httpx` implementation when using token reuse with nonce counting, then that *might* indicate that the issue is on the server/application side?

**Comment by pergolafabio** [comment]
I have some ISAPi documents, can share later

**Comment by pergolafabio** [comment]
Here is the link to all ISAPi docs from Hikvision that I also share on Home Assistant forum.. it's for all hardware...

https://www.dropbox.com/s/obppstvpvxja9l7/isapi.zip?dl=0

**Comment by Fauzan4869** [comment]
package com---------------------;

import org.apache.http.HttpEntity;
import org.apache.http.HttpResponse;
import org.apache.http.auth.AuthScope;
import org.apache.http.auth.UsernamePasswordCredentials;
import org.apache.http.client.CredentialsProvider;
import org.apache.http.client.methods.HttpGet;
import org.apache.http.impl.client.BasicCredentialsProvider;
import org.apache.http.impl.client.CloseableHttpClient;
import org.apache.http.impl.client.HttpClients;
import org.apache.http.util.EntityUtils;

import java.io.IOException;

import java.io.File;
import java.nio.file.Files;
import java.nio.file.Path;
import java.nio.file.StandardOpenOption;
import java.util.Scanner;





public class DigestAuthISAPI {
	
	

    public static void main(String[] args) {
    	
        Scanner scanner = new Scanner(System.in);
        
        // MASUKKAN NAMA USER PATH ANDA
        System.out.print("MASUKKAN IP CAMERA: ");
        String ip = scanner.nextLine();
        
        // MASUKKAN NAMA USER PATH ANDA
        System.out.print("MASUKKAN NAMA USER PATH ANDA: ");
        String pathCam = scanner.nextLine();

        // MASUKKAN FOTO KE BERAPA ( SUPAYA TIDAK MEREPLACE FOTO YANG SUDAH ADA )
        System.out.print("MASUKKAN FOTO KE BERAPA: ");
        int take = scanner.nextInt();    	
    	
    	String url = "";
        url = "http://" + ip + "/ISAPI/Streaming/Channels/1/picture";
        String passwordCam = "username:password";
        
		String nama = "";
		String path = "";
		path = "/home/" + pathCam + "...............................";
		nama = "hasilcam_ " + take + ".JPG";

		
        // Tutup Scanner setelah selesai digunakan
        scanner.close(); 		
		
        try {
        	
	        String[] credentials = passwordCam.split(":");
	        String username = credentials[0];
	        String password = credentials[1];			
			        	
        	
            // Setting - setting Credential Provider
            CredentialsProvider credentialsProvider = new BasicCredentialsProvider();
            credentialsProvider.setCredentials(
                    new AuthScope(AuthScope.ANY),
                    new UsernamePasswordCredentials(username, password)
            ); 

            // Membuat Client HTTP Dengan Autentikasi Digest
            CloseableHttpClient httpClient = HttpClients.custom()
                    .setDefaultCredentialsProvider(credentialsProvider)
                    .build();

            // Membuat Permintaan HTTP GET
            HttpGet httpGet = new HttpGet(url);

            // Eksekusi Permintaan
            HttpResponse response = httpClient.execute(httpGet);

            // Memeriksa Respon Status
            int statusCode = response.getStatusLine().getStatusCode();
            if (statusCode == 200) {
                // Permintaan Berhasil, Melakukan Proses Responnya
                HttpEntity entity = response.getEntity();

                // Mengatur File Path / Direktori
                Path targetPath = (new File(path + nama)).toPath();

                // Mengecek apakah direktori sudah ada
                File directory = targetPath.getParent().toFile();
                if (!directory.exists()) {
                    // Jika direktori belum ada, buat direktori baru
                    directory.mkdirs();
                }

                // Menjadikan Respon sebuah File
                Files.write(targetPath, EntityUtils.toByteArray(entity), StandardOpenOption.CREATE);

                // Mengecek apakah file sudah ada
                File file = targetPath.toFile();
                if (!file.exists()) {
                    // Jika file belum ada, buat file baru
                    file.createNewFile();
                }
                
                System.out.println("File created at: " + targetPath);

                
//                String responseBody = EntityUtils.toString(entity);
//                System.out.println("Response Body: " + responseBody);
            } else {
                // Request failed, handle the error
                System.err.println("Request failed with status code: " + statusCode);
            }

            // Close the HTTP client
            httpClient.close();

        } catch (IOException e) {
            e.printStackTrace();
        }
    }
}
